iRobot Braava Jet m6,369,4.1,541,Mopping robot,12.90 cm,,90 min,,"Programmable cleaning schedules, Programmable room boundary, Staircase safe","Amazon Alexa, Apple Siri, Google Assistant, IFTTT, Swisscom HOME App",43164338,iRobot,Robot vacuum cleaners,m613340,26.2.2024,127 of 471,No,"Black, Silver","Black, Silver",Mopping robot,Damp mopping,"Programmable cleaning schedules, Programmable room boundary, Staircase safe",,,0.45 l,,"Laminate, Parquet flooring, Stone, Tiles",6 mm,,100 m²,Compatible,"Amazon Alexa, Apple Siri, Google Assistant, IFTTT, Swisscom HOME App","Amazon Alexa, Apple Siri, Google Assistant",,Braava jet m6,Braava jet m6,90 min,180 min,Li-ion,1775 mAh,,,,"1 dry wipe, 1 washable dry wipe, 1 washable wet wipe cloth, 2 wet wipes, Home Base Charging Station, Power cord, Sample cleaning solution",12.90 cm,,,49.50 cm,38.50 cm,5 kg,,,,,,,,,,,,,,,,,,,
iRobot Roomba Combo Essential Y0 (Y0112),133,3.9,59,Vacuum mopping robot,8 cm,14.50 cm,120 min,,"Programmable cleaning schedules, Staircase safe","Amazon Alexa, Google Assistant, Swisscom HOME App",43134731,iRobot,Robot vacuum cleaners,Y011240,9.4.2024,20 of 469,No,White,White,Vacuum mopping robot,"Damp mopping, Vacuuming","Programmable cleaning schedules, Staircase safe",,0.40 l,0.20 l,,"Carpet, Laminate, Parquet flooring, Stone, Tiles",16 mm,High-performance filters,,Compatible,"Amazon Alexa, Google Assistant, Swisscom HOME App","Amazon Alexa, Google Assistant",China,Roomba Combo Essential,Roomba Combo Essential,120 min,120 min,Li-ion,2600 mAh,,,,"1 Roomba Combo™ Essential robot hoover and mop, 1x Charging station, 1x Roomba Combo Essential, 1x tool",8 cm,14.50 cm,33 cm,35.50 cm,33 cm,4.20 kg,36 cm,44 cm,13 cm,4.30 kg,,,,,,,,,,,,,,,
iRobot Roomba Combo j7+,449,4.2,105,Vacuum mopping robot,8.50 cm,33.70 cm,120 min,68 dB,"Base station, Camera function, Laser navigation, Obstacle detector, Programmable cleaning schedules, Programmable room boundary, Staircase safe","Amazon Alexa, Apple Siri, Google Assistant, IFTTT, Swisscom HOME App",22503264,iRobot,Robot vacuum cleaners,c755840,18.10.2022,36 of 469,No,"Black, Silver","Black, Silver",Vacuum mopping robot,"Damp mopping, Vacuuming","Base station, Camera function, Laser navigation, Obstacle detector, Programmable cleaning schedules, Programmable room boundary, Staircase safe",,0.31 l,0.21 l,68 dB,"Carpet, Hard floor, Laminate, Parquet flooring, Stone, Tiles, Tiles",16 mm,High-performance filters,90 m²,Compatible,"Amazon Alexa, Apple Siri, Google Assistant, IFTTT, Swisscom HOME App","Amazon Alexa, Apple HomeKit, Google Assistant",China,Roomba Combo j7+,Roomba Combo j7+,120 min,120 min,Li-ion,4400 mAh,,14.40 V,,"1 corner and edge cleaning brush, 1 microfibre cleaning cloth, 2 anti-allergen dust bags, Clean Base charging station + automatic emptying, Power cord, Replacement filter",8.50 cm,33.70 cm,33.30 cm,39.80 cm,31.70 cm,3.40 kg,46 cm,37 cm,38 cm,11 kg,,,Https://prod-help-content.care.irobotapi.com/files/j_series/og/J7ComboOwnersGuideEMEA.pdf.,,,,,,,,,,,,
Dreame L10s Pro Gen 2,40634,4.4,18,Vacuum mopping robot,9.85 cm,9.26 cm,160 min,72 dB,"Base station, Laser navigation, Obstacle detector","Amazon Alexa, Apple Siri, Google Assistant",43915293,Dreame,Robot vacuum cleaners,010201AA000273,16.3.2024,34 of 469,No,White,White,Vacuum mopping robot,"Damp mopping, Vacuuming","Base station, Laser navigation, Obstacle detector",7000 Pa,0.47 l,0.30 l,72 dB,"Carpet, Hard floor",22 mm,,145 m²,Compatible,"Amazon Alexa, Apple Siri, Google Assistant",,,,L10s Pro Gen2,160 min,360 min,Li-ion,5200 mAh,,14.40 V,75 W,"Charging station, Power cord, Robot vacuum, Side brush, User manual, Wiper pad, Wiper pad holder",9.85 cm,9.26 cm,35 cm,41.10 cm,35 cm,4.20 kg,45.80 cm,40.80 cm,14.20 cm,6.06 kg,,,,,,,,,,,,,,,
Dreame L10s Ultra Gen 2,449,4.9,29,Vacuum mopping robot,9.72 cm,59.05 cm,240 min,74 dB,"Automatic dust emptying, Base station","Amazon Alexa, Apple Siri, Google Assistant",49039640,Dreame,Robot vacuum cleaners,010204AA000485,3.9.2024,22 of 469,No,White,White,Vacuum mopping robot,"Damp mopping, Vacuuming","Automatic dust emptying, Base station",10000 Pa,0.30 l,0.08 l,74 dB,Hard floor,20 mm,,,Compatible,"Amazon Alexa, Apple Siri, Google Assistant",Amazon Alexa,,Dreame L10s,,240 min,210 min,Li-ion,5200 mAh,,14.40 V,700 W,Mop Pad,9.72 cm,59.05 cm,35 cm,35 cm,35 cm,13.30 kg,66 cm,43 cm,41.50 cm,18.35 kg,,,,,,,,,,,,,,,
Roborock Q8 Max,420,4.8,23,Vacuum mopping robot,9.56 cm,,240 min,67 dB,Obstacle detector,"Amazon Alexa, Apple Siri, Google Home",38866576,Roborock,Robot vacuum cleaners,Q8M52-00,26.9.2023,69 of 469,No,Black,Black,Vacuum mopping robot,"Damp mopping, Vacuuming",Obstacle detector,5500 Pa,0.77 l,0.35 l,67 dB,"Carpet, Hard floor",20 mm,,,Compatible,"Amazon Alexa, Apple Siri, Google Home",Amazon Alexa,China,,R100044,240 min,360 min,Li-ion,5200 mAh,59 Wh,,59 W,"Charging station, Manual, Mop attachment, Mop pad, Power cable, Power cord, Robots, Water reservoir",9.56 cm,,,35.31 cm,35 cm,4 kg,45 cm,40 cm,14 cm,6.09 kg,,,,,,,,,,,,,,,
Roborock Q5 Max+,30298,5.0,1,Robot vacuum,9.65 cm,44.80 cm,240 min,67 dB,Base station,"Amazon Alexa, Google Assistant",49228888,Roborock,Robot vacuum cleaners,RSD0743CE,10.9.2024,31 of 469,No,Black,Black,Robot vacuum,Vacuuming,Base station,5500 Pa,0.77 l,0.18 l,67 dB,"Carpet, Laminate, Parquet flooring, Tiles",20 mm,Dust filters,300 m²,Compatible,"Amazon Alexa, Google Assistant",Apple Siri,China,Q Revo,,240 min,180 min,,5200 mAh,,,60 W,"1x dock with automatic emptying, 1x dust bag, 1x power cable, 1x robot hoover",9.65 cm,44.80 cm,35 cm,35.30 cm,35 cm,5 kg,49 cm,38 cm,36.50 cm,11.40 kg,,,,,,,,,,,,,,,
Mova E30 Ultra,449,5.0,3,Vacuum mopping robot,9.72 cm,,260 min,74 dB,"Automatic dust emptying, Automatic power adjustment, Base station, Carpet detection, Independent emptying, Programmable cleaning schedules, Programmable room boundary, Staircase safe","Amazon Alexa, Apple Siri, Google Assistant",47655505,Mova,Robot vacuum cleaners,RLE51SE,22.2.2025,25 of 469,,White,White,Vacuum mopping robot,Damp mopping,"Automatic dust emptying, Automatic power adjustment, Base station, Carpet detection, Independent emptying, Programmable cleaning schedules, Programmable room boundary, Staircase safe",7000 Pa,3.20 l,,74 dB,"Carpet, Hard floor, Laminate, Linoleum, Parquet flooring, Tiles, Wood",22 mm,,,Compatible,"Amazon Alexa, Apple Siri, Google Assistant",Google Assistant,China,,E30ULTRA,260 min,210 min,Li-ion,5200 mAh,,14.40 V,700 W,"Charging station and cleaning station, Dust collector, Manual, Mop cloths x 2, Optical input, Power cord, Robots, Side brush, Vacuum cleaner bag, Water reservoir",9.72 cm,,35 cm,0 cm,35 cm,3.82 kg,66 cm,43.30 cm,41.90 cm,17.19 kg,,,,,,,,,,,,,,,
iRobot Roomba i1+,293,4.3,3,Robot vacuum,9.25 cm,,75 min,70 dB,"Programmable cleaning schedules, Programmable room boundary, Staircase safe","Amazon Alexa, Apple Siri, Google Assistant, IFTTT, Swisscom HOME App",40721401,iRobot,Robot vacuum cleaners,I155640,4.10.2023,47 of 469,No,"Black, Grey","Black, Light grey",Robot vacuum,Vacuuming,"Programmable cleaning schedules, Programmable room boundary, Staircase safe",,0.40 l,,70 dB,"Carpet, Laminate, Parquet flooring, Stone, Tiles",16 mm,High-performance filters,,Compatible,"Amazon Alexa, Apple Siri, Google Assistant, IFTTT, Swisscom HOME App","Amazon Alexa, Apple Siri, Google Assistant",,Roomba i1+,Roomba i1+,75 min,75 min,Li-ion,1800 mAh,,,,"1 additional filter, 2 anti-allergenic dust bags, Clean Base charging station + automatic emptying, Home Base Charging Station, Power cord, Roomba i1+",9.25 cm,,34.20 cm,34 cm,34 cm,3.18 kg,38.50 cm,46.50 cm,38.50 cm,10.25 kg,,,,,,,,,,,,,,,
Xiaomi Mi Robot Vacuum S10+,239,4.5,45,Vacuum mopping robot,9.70 cm,9.30 cm,120 min,55 dB,Programmable room boundary,Amazon Alexa,25478841,Xiaomi,Robot vacuum cleaners,BHR6368EU,22.5.2023,32 of 469,No,White,White,Vacuum mopping robot,"Damp mopping, Vacuuming",Programmable room boundary,4000 Pa,0.45 l,0.20 l,55 dB,Linoleum,,Dust filters,200 m²,Compatible,Amazon Alexa,Google Assistant,,,S10+ EU,120 min,360 min,Li-ion,5200 mAh,55 Wh,14.40 V,55 W,"Charging dock, Cleaning tool x 1, Power adapter, Robottolmuimeja, Side brush, User Manual, Water reservoir",9.70 cm,9.30 cm,35 cm,35 cm,35 cm,3.80 kg,44.90 cm,39.70 cm,13.20 cm,6.05 kg,,,,,,,,,,,,,,,
Dreame L20 Ultra Complete,89214,4.7,365,Vacuum mopping robot,10.30 cm,60.80 cm,180 min,63 dB,"Area cleaning, Automatic detergent addition, Automatic dust emptying, Automatic mop pad separation, Automatic power adjustment, Automatic water refill, Base station, Camera function, Carpet detection, Configurable cleaning programmes, Extendable wiping pads, Fixed water connection, Independent emptying, Obstacle detector, Programmable cleaning schedules, Programmable room boundary, Removable water tank, Self-cleaning mop pads","Amazon Alexa, Apple Siri, Google Assistant",37230857,Dreame,Robot vacuum cleaners,RLX41CE,1.9.2023,46 of 469,Yes,White,White,Vacuum mopping robot,"Damp mopping, Vacuuming","Area cleaning, Automatic detergent addition, Automatic dust emptying, Automatic mop pad separation, Automatic power adjustment, Automatic water refill, Base station, Camera function, Carpet detection, Configurable cleaning programmes, Extendable wiping pads, Fixed water connection, Independent emptying, Obstacle detector, Programmable cleaning schedules, Programmable room boundary, Removable water tank, Self-cleaning mop pads",7000 Pa,0.30 l,4.50 l,63 dB,"Carpet, Hard floor, Laminate, Parquet flooring, Tiles",20 mm,"Dust filters, HEPA filter",,Compatible,"Amazon Alexa, Apple Siri, Google Assistant","Amazon Alexa, Google Assistant",China,,,180 min,180 min,Li-ion,6400 mAh,75 Wh,14.40 V,75 W,"14x mop pad, 1x charging and self-cleaning station, 1x Dreame L20 Ultra, 2x main brush, 3x side brush, 4x cleaning solution, 4x dust box filter, 5x dust bag, Cleaning tool, Operating instructions, Power cables",10.30 cm,60.80 cm,35 cm,35 cm,35 cm,4.30 kg,68 cm,52 cm,65 cm,27.50 kg,,,,,,,,,,,,,,,
Xiaomi X20 Pro,418,4.8,5,Vacuum mopping robot,9.70 cm,56.30 cm,160 min,60 dB,"Automatic power adjustment, Camera-based navigation, Carpet detection, Independent emptying, Laser navigation, Obstacle detector, Programmable room boundary","Amazon Alexa, Google Assistant",52931097,Xiaomi,Robot vacuum cleaners,BHR8859EU,13.11.2024,41 of 469,Yes,White,White,Vacuum mopping robot,"Damp mopping, Vacuuming","Automatic power adjustment, Camera-based navigation, Carpet detection, Independent emptying, Laser navigation, Obstacle detector, Programmable room boundary",7000 Pa,2.50 l,4 l,60 dB,"Carpet, Hard floor, Linoleum, Parquet flooring, Wood",10 mm,HEPA filter,120 m²,Compatible,"Amazon Alexa, Google Assistant","Amazon Alexa, Google Assistant",China,,BHR8859EU,160 min,390 min,Li-ion,5200 mAh,,14.40 V,55 W,"Charging station and cleaning station, Dirty water tank, Dust collector, Extension of the tray base x 1, Main brush, Main brush cap x 1, Manual, Mop pad holder x 2, Mop pad x 2, Power cable, Short guide, Side brush, Tray x 1, Vacuum cleaners, Warranty card, Water reservoir",9.70 cm,56.30 cm,35 cm,40 cm,35 cm,3.70 kg,61.50 cm,43.20 cm,40 cm,16.86 kg,,,,,,,,,,,,,,,
Xiaomi E5,115,4.0,24,Vacuum mopping robot,7 cm,82.50 cm,110 min,65 dB,"Obstacle detector, Staircase safe","Amazon Alexa, Google Assistant",43091385,Xiaomi,Robot vacuum cleaners,BHR7969EU,22.2.2024,35 of 469,No,White,White,Vacuum mopping robot,"Damp mopping, Vacuuming","Obstacle detector, Staircase safe",2000 Pa,0.40 l,0.40 l,65 dB,"Carpet, Hard floor",20 mm,HEPA filter,,Compatible,"Amazon Alexa, Google Assistant",,China,,BHR7969EU,110 min,,,2600 mAh,25 Wh,14.40 V,25 W,"Charging station, Cleaning brush x 1, Dust collector, Manual, Mop pad, Power supply, Robots, Side brush x 2, Water reservoir",7 cm,82.50 cm,30 cm,30 cm,30 cm,2.30 kg,42.10 cm,37.40 cm,13.10 cm,3.62 kg,,,,,,,,,,,,,,,
Kärcher RCV 5,378,4.7,27,Vacuum mopping robot,9.70 cm,9.70 cm,120 min,66 dB,"Laser navigation, Programmable room boundary",,25366746,Kärcher,Robot vacuum cleaners,1.269-640.0,11.5.2023,38 of 469,No,White,White,Vacuum mopping robot,"Damp mopping, Vacuuming","Laser navigation, Programmable room boundary",5000 Pa,0.33 l,0.24 l,66 dB,"Carpet, Cork, Hard floor, Laminate, Linoleum, Parquet flooring, Stone, Tiles, Vinyl",20 mm,Dust filters,85 m²,Compatible,,,,,RCV 5,120 min,230 min,Li-ion,5200 mAh,,14.40 V,36 W,Charging station,9.70 cm,9.70 cm,35 cm,35 cm,35 cm,3.90 kg,46.10 cm,42.80 cm,15.10 cm,6.33 kg,,,,SBTi,,,,,,,,,,,
iRobot Roomba Combo j5+,399,4.3,31,Vacuum mopping robot,8.56 cm,38.50 cm,75 min,,"Carpet detection, Obstacle detector, Programmable cleaning schedules, Programmable room boundary, Staircase safe","Amazon Alexa, Apple Siri, Google Assistant, IFTTT",39130700,iRobot,Robot vacuum cleaners,J557840,19.12.2023,61 of 469,No,"Black, Grey","Black, Silver",Vacuum mopping robot,"Damp mopping, Vacuuming","Carpet detection, Obstacle detector, Programmable cleaning schedules, Programmable room boundary, Staircase safe",,0.31 l,0.21 l,,"Carpet, Laminate, Parquet flooring, Stone, Tiles",16 mm,High-performance filters,,Compatible,"Amazon Alexa, Apple Siri, Google Assistant, IFTTT","Amazon Alexa, Apple Siri, Google Assistant",China,Roomba Combo i5+,Roomba Combo j5+,75 min,120 min,Li-ion,2210 mAh,,,,1 piece,8.56 cm,38.50 cm,33.90 cm,33.80 cm,33.90 cm,3.40 kg,38 cm,46 cm,38 cm,10.32 kg,,,Https://prod-help-content.care.irobotapi.com/files/guide/OGComboj5plus.pdf.,,,,,,,,,,,,
Dreame D9 Max Gen 2,169,5.0,3,Vacuum mopping robot,9.68 cm,13 cm,210 min,74 dB,Laser navigation,"Amazon Alexa, Apple Siri, Google Assistant",46399823,Dreame,Robot vacuum cleaners,RLD34GA,10.6.2024,55 of 469,No,White,White,Vacuum mopping robot,"Damp mopping, Vacuuming",Laser navigation,6000 Pa,0.57 l,0.24 l,74 dB,Hard floor,22 mm,HEPA filter,270 m²,Compatible,"Amazon Alexa, Apple Siri, Google Assistant","Amazon Alexa, Apple HomeKit, Google Assistant",China,,D9 Max Gen2,210 min,360 min,Li-ion,5200 mAh,75 Wh,14.40 V,75 W,"Charging station, Manual, Mop attachment, Power cable, Side brush, Vacuum cleaners, Water reservoir",9.68 cm,13 cm,35 cm,46 cm,35 cm,3.60 kg,44.60 cm,40 cm,14.50 cm,5.32 kg,,,,,,,,,,,,,,,
Dreame X40 Master,1082,4.0,7,Vacuum mopping robot,10.38 cm,28 cm,330 min,76 dB,"Area cleaning, Automatic detergent addition, Automatic dust emptying, Automatic mop pad separation, Automatic power adjustment, Base station, Camera function, Carpet detection, Configurable cleaning programmes, Extendable wiping pads, Obstacle detector, Programmable room boundary, Removable water tank, Self-cleaning mop pads","Amazon Alexa, Apple Siri, Google Assistant",47230808,Dreame,Robot vacuum cleaners,010204AA000406,15.7.2024,77 of 469,Yes,Black,Black,Vacuum mopping robot,"Damp mopping, Vacuuming","Area cleaning, Automatic detergent addition, Automatic dust emptying, Automatic mop pad separation, Automatic power adjustment, Base station, Camera function, Carpet detection, Configurable cleaning programmes, Extendable wiping pads, Obstacle detector, Programmable room boundary, Removable water tank, Self-cleaning mop pads",12000 Pa,0.30 l,0.08 l,76 dB,"Carpet, Hard floor",22 mm,,,Compatible,"Amazon Alexa, Apple Siri, Google Assistant","Amazon Alexa, Google Assistant",,,,330 min,270 min,Li-ion,6400 mAh,,14.40 V,1000 W,,10.38 cm,28 cm,35 cm,48.50 cm,42.60 cm,15.90 kg,67 cm,54 cm,54 cm,26.80 kg,,,,,,,,,,,,,,,
Ecovacs DEEBOT T30 OMNI,63905,4.7,10,Vacuum mopping robot,10.40 cm,40.90 cm,290 min,65 dB,"Base station, Programmable room boundary","Amazon Alexa, Google Assistant",42912218,Ecovacs,Robot vacuum cleaners,DDX11,21.5.2024,51 of 469,Yes,Black,Black,Vacuum mopping robot,"Damp mopping, Vacuuming","Base station, Programmable room boundary",11000 Pa,0.30 l,0.06 l,65 dB,"Carpet, Laminate, Parquet flooring, Tiles",20 mm,Dust filters,200 m²,Compatible,"Amazon Alexa, Google Assistant","Amazon Alexa, Google Assistant",China,,DEEBOT T30 OMNI,290 min,270 min,Li-ion,5200 mAh,60 Wh,14.40 V,60 W,"1 pair, 1x Charging station, 1x robot, 1x side brush",10.40 cm,40.90 cm,,78 cm,45.70 cm,18.18 kg,76.50 cm,44.20 cm,46.20 cm,18.18 kg,,,,,,,,,,,,,,,
Xiaomi S20,157,4.1,12,Robot vacuum,9.80 cm,9.80 cm,120 min,60 dB,Base station,"Amazon Alexa, Google Assistant, Google Home",47387431,Xiaomi,Robot vacuum cleaners,BHR8628EU,24.7.2024,58 of 471,No,Black,Black,Robot vacuum,"Damp mopping, Vacuuming",Base station,5000 Pa,0.40 l,0.27 l,60 dB,Hard floor,,HEPA filter,,Compatible,"Amazon Alexa, Google Assistant, Google Home",Amazon Alexa,China,,BHR8628EU,120 min,,,3200 mAh,,14.40 V,45 W,"1 x power supply, 1x 2-in-1 dust container with water tank, 1x charging station, 1x cleaning brush, 1x main brush, 1x main brush cover, 1x robot hoover, 1x side brush, 1x user manual, 1x wiping pad",9.80 cm,9.80 cm,32.50 cm,32.50 cm,32.50 cm,3.50 kg,46.50 cm,39.10 cm,15.40 cm,5.02 kg,,,,,,,,,,,,,,,
Mova P50 Pro Ultra,768,4.3,6,Vacuum mopping robot,10.38 cm,47 cm,200 min,74 dB,"Automatic dust emptying, Automatic power adjustment, Base station, Carpet detection, Independent emptying, Programmable cleaning schedules, Programmable room boundary, Staircase safe","Amazon Alexa, Google Assistant",53184232,Mova,Robot vacuum cleaners,8509809000,5.2.2025,85 of 469,No,White,White,Vacuum mopping robot,"Damp mopping, Vacuuming","Automatic dust emptying, Automatic power adjustment, Base station, Carpet detection, Independent emptying, Programmable cleaning schedules, Programmable room boundary, Staircase safe",19000 Pa,3.20 l,0.08 l,74 dB,,20 mm,,,Compatible,"Amazon Alexa, Google Assistant",,China,,,200 min,210 min,Li-ion,5200000 mAh,,14.40 V,700 W,"Base station ramp extension x 1, Charging station and cleaning station, Cleaning agent x 1, Filter, Manual, Mop cloths x 2, Robots, Vacuum cleaner bag",10.38 cm,47 cm,35 cm,35 cm,35 cm,4 kg,59.80 cm,49 cm,54 cm,21.41 kg,,,,,,,,,,,,,,,
Dreame L10s Ultra,43920,4.6,229,Vacuum mopping robot,9.70 cm,97 cm,210 min,59 dB,"Base station, Camera function, Carpet detection, Configurable cleaning programmes, Obstacle detector, Programmable room boundary","Amazon Alexa, Apple Siri, Google Assistant",22605307,Dreame,Robot vacuum cleaners,RLS6LADC,4.12.2023,158 of 471,Yes,White,White,Vacuum mopping robot,"Damp mopping, Vacuuming","Base station, Camera function, Carpet detection, Configurable cleaning programmes, Obstacle detector, Programmable room boundary",5300 Pa,3 l,2.50 l,59 dB,"Carpet, Hard floor, Laminate, Parquet flooring, Tiles",20 mm,HEPA filter,200 m²,Compatible,"Amazon Alexa, Apple Siri, Google Assistant",Google Assistant,,,DreameBot L10s Ultra,210 min,360 min,Li-ion,5200 mAh,55 Wh,14.40 V,75 W,"Cleaning brush, Robots, Stromka, Vacuum cleaner bag",9.70 cm,97 cm,35 cm,35 cm,35 cm,3.70 kg,66 cm,50 cm,41 cm,17.45 kg,,,,,,,,,,,,,,,
Medion X20,227,4.0,23,Vacuum mopping robot,9.30 cm,,150 min,68 dB,,"Amazon Alexa, Apple Home",30358679,Medion,Robot vacuum cleaners,MD 11415,11.5.2023,45 of 469,No,White,White,Vacuum mopping robot,"Damp mopping, Vacuuming",,3000 Pa,0.25 l,,68 dB,"Carpet, Laminate, Parquet flooring, Tiles",,HEPA filter,,Compatible,"Amazon Alexa, Apple Home",Apple HomeKit,,,50076256,150 min,300 min,Li-ion,,,,,"1x hoover, 1x charger, 3x dust bag, 1x water tank, 2x replacement brush, 1x replacement filter, 1x suction station",9.30 cm,,32 cm,32 cm,32 cm,3 kg,45 cm,40.50 cm,36.50 cm,9.76 kg,,,,,,,,,,,,,,,
iRobot Roomba Combo 10 Max,826,4.3,15,Vacuum mopping robot,8.70 cm,44.60 cm,120 min,,"Area cleaning, Base station, Camera function, Carpet detection, Configurable cleaning programmes, Independent emptying, Infrared sensor, Obstacle detector, Programmable room boundary, Removable water tank, Self-cleaning mop pads, Staircase safe","Amazon Alexa, Apple Siri, Google Assistant, IFTTT, Swisscom HOME App",47497717,iRobot,Robot vacuum cleaners,x085840,12.9.2024,40 of 469,Yes,Black,Black,Vacuum mopping robot,"Damp mopping, Vacuuming","Area cleaning, Base station, Camera function, Carpet detection, Configurable cleaning programmes, Independent emptying, Infrared sensor, Obstacle detector, Programmable room boundary, Removable water tank, Self-cleaning mop pads, Staircase safe",,0.31 l,0.25 l,,"Carpet, Laminate, Parquet flooring, Stone, Tiles",16 mm,High-performance filters,,Compatible,"Amazon Alexa, Apple Siri, Google Assistant, IFTTT, Swisscom HOME App",Amazon Alexa,,,Roomba Combo 10 max,120 min,,Li-ion,4200 mAh,,,,"1 additional corner and edge brush, 1 additional hoover bag, 1 additional microfibre cleaning cloth, 1 replacement high-performance filter, AutoWash Dock, Power cord",8.70 cm,44.60 cm,33.90 cm,33.90 cm,33.80 cm,5 kg,49.10 cm,44.30 cm,42.70 cm,18.05 kg,,,,,,,,,,,,,,,
Mova M1,158,4.3,12,Vacuum mopping robot,7.60 cm,,150 min,60 dB,,"Amazon Alexa, Apple Siri, Google Assistant",42600452,Mova,Robot vacuum cleaners,MOVAM1,30.1.2024,50 of 469,No,White,White,Vacuum mopping robot,"Damp mopping, Vacuuming",,4500 Pa,0.30 l,0.22 l,60 dB,"Carpet, Hard floor",,EPA filter,,Compatible,"Amazon Alexa, Apple Siri, Google Assistant",,Germany,,RPM1GA,150 min,240 min,Li-ion,2600 mAh,40 Wh,14.40 V,40 W,"Battery charger, Charging station, Cleaning tool x 1, Manual, Robots, Side brush",7.60 cm,,32.50 cm,32.50 cm,32.50 cm,2.50 kg,43.30 cm,36.50 cm,12.50 cm,4.11 kg,,,,,,,,,,,,,,,
iRobot Roomba Combo i5,226,4.6,16,Vacuum mopping robot,16.50 cm,14.80 cm,60 min,,"Carpet detection, Programmable room boundary, Staircase safe","Amazon Alexa, Apple Siri, Google Assistant, IFTTT, Swisscom HOME App",38718039,iRobot,Robot vacuum cleaners,I517840,20.9.2023,60 of 469,No,"Black, Grey","Black, Gray",Vacuum mopping robot,"Damp mopping, Vacuuming","Carpet detection, Programmable room boundary, Staircase safe",,0.39 l,0.21 l,,"Carpet, Laminate, Parquet flooring, Stone, Tiles",16 mm,High-performance filters,55 m²,Compatible,"Amazon Alexa, Apple Siri, Google Assistant, IFTTT, Swisscom HOME App","Amazon Alexa, Apple Siri, Google Assistant",China,Roomba Combo i5+,Roomba Combo i5,60 min,90 min,Li-ion,1850 mAh,,,,"1 additional filter, 1 drip tray, 1 dust collector, 1 Roomba® Combo container, 2 additional microfibre mop pad, Home Base Charging Station, Power cord, Roomba Combo i5",16.50 cm,14.80 cm,34 cm,34 cm,34.20 cm,3.20 kg,54.10 cm,43.30 cm,15 cm,5.65 kg,,,"Https://prod-help-content.care.irobotapi.com/files/guide/OGRoombaComboi5.pdf
https://prod-help-content.care.irobotapi.com/files/guide/QSGRoombaComboi5.pdf.",,,,,,,,,,,,
Roborock Q5 Pro+,34195,4.0,7,Vacuum mopping robot,9.65 cm,44.80 cm,240 min,67 dB,"Obstacle detector, Programmable cleaning schedules",Amazon Alexa,38864695,Roborock,Robot vacuum cleaners,R100039,11.6.2024,49 of 469,Yes,Black,Black,Vacuum mopping robot,"Damp mopping, Vacuuming","Obstacle detector, Programmable cleaning schedules",5500 Pa,0.77 l,0.18 l,67 dB,"Carpet, Laminate, Parquet flooring, Tiles",20 mm,Dust filters,350 m²,Compatible,Amazon Alexa,"Amazon Alexa, Google Assistant",China,,Q5 Pro +,240 min,360 min,Li-ion,5200 mAh,,,59 W,"Charging station, Cleaning station, Manual, Power cable, Robots, Water reservoir, Wiping cloth",9.65 cm,44.80 cm,44.70 cm,44.70 cm,35.30 cm,7.50 kg,49 cm,38 cm,37 cm,11.64 kg,,,,,,,,,,,,,,,
Xiaomi MI Robot Vacuum S12,223,4.6,81,Vacuum mopping robot,9.40 cm,,130 min,75 dB,Programmable room boundary,"Amazon Alexa, Google Assistant",33027105,Xiaomi,Robot vacuum cleaners,BHR7328GL,22.5.2023,59 of 469,No,White,White,Vacuum mopping robot,"Damp mopping, Vacuuming",Programmable room boundary,4000 Pa,0.30 l,0.30 l,75 dB,"Carpet, Laminate, Parquet flooring, Tiles",,HEPA filter,,Compatible,"Amazon Alexa, Google Assistant","Amazon Alexa, Google Assistant",China,,BHR7328GL,130 min,210 min,,3200 mAh,45 Wh,14.80 V,45 W,"Charging station, Cleaning brush, Filter x 2, Main brush, Main brush guard, Manual, Mop frame x 1, Mop pad, Power supply, Robots, Side brush, Water and dust container",9.40 cm,,35 cm,35 cm,35 cm,4.80 kg,53.10 cm,42 cm,13.90 cm,6.24 kg,,,,,,,,,,,,,,,
Roborock Q8 Max+,518,4.6,34,Vacuum mopping robot,9.65 cm,,240 min,67 dB,Independent emptying,Amazon Alexa,38732566,Roborock,Robot vacuum cleaners,Q8MP02-00,21.9.2023,97 of 471,Yes,White,White,Vacuum mopping robot,"Damp mopping, Vacuuming",Independent emptying,5500 Pa,0.47 l,0.35 l,67 dB,"Carpet, Hard floor",20 mm,Preliminary filter,300 m²,Compatible,Amazon Alexa,Amazon Alexa,China,,Q8 Max+,240 min,360 min,Li-ion,5200 mAh,59 Wh,14.40 V,1000 W,"Charging station, Cleaning station, Manual, Mop attachment, Mop pad, Power cable, Power cord, Robots, Water reservoir",9.65 cm,,35.30 cm,35 cm,35 cm,3.60 kg,48.50 cm,38.50 cm,37 cm,12.40 kg,,,,,,,,,,,,,,,
Medion Saugroboter S35,129,5.0,1,Robot vacuum,7.40 cm,,120 min,72 dB,"Base station, Carpet detection, Obstacle detector",,52303356,Medion,Robot vacuum cleaners,50076260,19.10.2024,70 of 469,No,White,White,Robot vacuum,Vacuuming,"Base station, Carpet detection, Obstacle detector",4000 Pa,0.55 l,,72 dB,"Carpet, Hard floor",,Dust filters,,Compatible,,,,,MD 11899,120 min,300 min,Li-ion,,,,,"1x Charging station, 1x cleaning brush, 1x remote, 2x batteries (AAA), 4x side brush (2 x replacement side brushes), Robot vacuum cleaner (MD 11899)",7.40 cm,,32.50 cm,32.50 cm,32.50 cm,2.60 kg,46 cm,39 cm,13.70 cm,4.54 kg,,,,,,,,,,,,,,,
Ecovacs T30S Combo Complete,905,4.9,8,Robot vacuum,10.40 cm,44.50 cm,270 min,65 dB,Laser navigation,"Amazon Alexa, Google Assistant",46593512,Ecovacs,Robot vacuum cleaners,101994,18.6.2024,56 of 469,Yes,Black,Black,Robot vacuum,"Damp mopping, Vacuuming",Laser navigation,11000 Pa,0.28 l,0.06 l,65 dB,Carpet,20 mm,,,Compatible,"Amazon Alexa, Google Assistant",,China,,DDX14-2,270 min,300 min,Li-ion,5200 mAh,60 Wh,14.40 V,60 W,"1 COMBO station, 1 main brush, DEEBOT T30S COMBO COMPLETE",10.40 cm,44.50 cm,35.10 cm,3.53 cm,3.51 cm,4.10 kg,75 cm,49 cm,62 cm,26 kg,,,,,,,,,,,,,,,
